Summary,Sentiment
frustrating tweener slick contrived exploitative art house cynical small decadent mall,0
gone straight video look like action movie poorly made level even qualify spoof,0
impostor think thing character except run dark tunnel fight various anonymous attacker evade elaborate surveillance technology,0
empire make mind whether want gangster flick art film work either,0
performance top notch get accent nothing becomes emotional though still positive wrench sit,1
exuberantly romantic serenely melancholy time may prove tsai masterpiece,1
vivid cinematic portrait,1
ebullient tunisian film startling transformation tradition bound widow drawn exotic world belly dancing,1
film never rise conventional two dimension tale,0
offbeat treat poke fun democratic exercise also examining significance take part,1
philosophically intellectually logistically mess,0
much moved emotional tumult fran ois mich le relationship depends lot interesting likable find,0
ending leave unfulfilled performance enjoy memorable ensemble piece,1
made teen reviewed recommended year age mild rental,1
excellent romp boast heart mind,1
call good girl date movie anti date movie like good good horrid,1
sitting third row imax cinema sydney darling harbour sometimes felt though tiny two seater plane carried giant camera around australia sweeping gliding banking hovering,1
plodding poorly written murky weakly acted picture feel everyone making lost movie mojo,0
engaging overview johnson eccentric career,1
possibly irresponsible picture ever released major film studio,0
reno delivers monologue manages incorporate horror absurdity situation well balanced fashion,1
brutally dry satire middle american numbness,1
damn weird pas blacklight crowd way cheaper better pink floyd ticket,1
funny time poignant film director george hickenlooper take place pasadena city people still read,1
kiddie oriented stinker bad even caught gum stuck seat trying sneak theater,0
hard resist,1
painfully padded,0
peter jackson done nearly impossible improved upon first taken step richer deeper jackson done proven amount imagination creature fantasy story incredibly outlandish scenery,1
little recommend snow dog unless one considers cliched dialogue perverse escapism source high hilarity,0
another week another gross college comedy ugh,0
full detail man country well worth seeing,1
present astute appraisal middle american musical torpor desperate struggle escape,1
end film feel homogenized bit contrived looking back tattered ugly past rose tinted glass,0
era soprano feel painfully redundant inauthentic,0
much better documentary revealing emotional surprising pedestrian english title would believe,1
really dumb occasionally really funny,0
pretty dicey material unexpected zig zag help,1
two lead chomp considerably scenery acting fire breathing monster barbecue breath,1
russell make good b movie mask blob scorpion king ably meet standard,1
lightweight filmmaking sure pleasant enough oozing attractive men,1
enough watch huppert scheming small intelligent eye steady noir villain enjoy perfectly pitched web tension chabrol spin,1
unique stubborn charismatic want better successful,1
mctiernan remake may lighter foot sober minded original graceful tap dancing rhino boring obvious,0
film fall back old formula teen sex outrageous prank scene designed push envelope bad taste laugh,0
one picture whose promising rather precious premise undercut amateurish execution,0
scherfig light hearted profile emotional desperation achingly honest delightfully cheeky,1
fan adventues steve terri avoid like dreaded king brown snake personally rather watch animal planet,0
sort picture whenever one character serious soul searching go picture perfect beach sunset,0
jason x cheesy effect hoary plot macabre self deprecating sense humor make lot,1
pc stability notwithstanding film suffers simplistic narrative pat fairy tale conclusion,0
terrific date movie whatever orientation,1
boom box movie might titled loud ludicrous pandering moviegoing audience dominated young male calculated,0
biggest problem roger avary uproar mpaa even director cut glory made film barely shocking barely interesting barely anything,0
smart provocative drama nearly impossible get skin man know evil monstrous lunatic,1
poster movie mediocre tribute film like,0
movie accumulated force still feel like ugly knot tightening stomach knot dramatic tension symptom artistic malnutrition,0
ozpetek effort scope shape especially well executed television movie,1
warm wise deftly setting uproarious humor underlying seriousness sneak viewer providing experience richer anticipated,1
bourne jason bourne scale building like super hero stealth agent get girl super spy,1
made feel uneasy even queasy solondz cool compassion border bemused contempt,0
jackson shamefully stroll mess smug grin inexplicably wearing kilt carrying bag golf club one shoulder,0
may real laugh,1
tired old gag modernized extreme sport generation already many film,0
scare mood ominous pervasive unknown threat lurks proceeding add almost constant mindset suspense,1
paid full remarkably engaging despite noticeably derivative goodfellas least half dozen trouble ghetto flick,1
fascinating film clear cut hero villain,1
marvellous journey childhood idealism adolescent self absorption,1
director michael dowse superficially understands character hold contempt,1
moonlight mile quite go distance cast impressive give life broken character trying make way tragedy,1
often gruelling heartbreaking witness seldahl wollter sterling performance raise far level usual maudlin disease movie,1
impressive though film open ended finale refuse entirely close character emotional wound,1
best drug addition movie usually depressing rewarding quitting however manages depressing lead actor phone autobiographical performance,0
downbeat nearly humorless becomes chore sit despite first rate performance lead,0
though nijinsky word grow increasingly disturbed film maintains beguiling serenity poise make accessible non narrative feature,1
one groan inducing familiarity begets another,0
dense thoughtful brimming idea complex rapidly absorbed,1
successful adaptation enjoyable film right,1
ill fitting tuxedo strictly rack,0
narc menace atmosphere,0
expect reminded better film especially seven director william malone slavishly copy,0
fascination come power huston performance seems larger life yet fragile way ivan character accepts news illness quickly still find unable react,1
gently funny sweetly adventurous film make feel genuinely good say entirely unconned false sentiment sharp overmanipulative hollywood practice,1
time wish movie worked little harder conceal contrivance brown sugar turn sweet enjoyable fantasy,1
singularly putting romantic comedy,0
time movie look genuinely pretty nightmare hand anything even felinni would know make italian freakshow,0
ultimately message trouble every day seems sexual desire disrupts life stasis,1
film lack general focus make compassion corcuera manages find seed hope form collective action,1
heroic tale persistence sure win viewer heart,1
last order nurture multi layer character allowing u remember life ultimately gamble last order embraced affecting amusing sad reflective,1
seen hippie turned yuppie plot enthusiastic charm fire make formula fresh,1
requisite faux urban vibe hotter two year ago rap r b name reference,0
puzzle whose piece fit fascinating others end almost good movie,0
suffers rambling repetitive dialogue visual drabness endemic digital video,0
sleep inducing thriller single twist everyone except character see coming mile away,0
lesson prehistoric hilarity,1
ever concept came handed movie god silver platter ever dependable concept botched execution,0
performer spot hard conceive anyone else role,1
effort suspect offend appearing either serious lighthearted offends wishy washy,0
difficult longtime admirer work swept invincible overlook drawback,0
hard pressed think film cloyingly sappy evelyn year,0
take simple premise carry unexpected height,1
distant even sterile yet compulsively watchable look sordid life hogan hero star bob crane,1
clint eastwood blood work lot like well made pb j sandwich familiar fairly uneventful boasting real surprise still quite tasty inviting,1
remember last time saw audience laugh much movie one problem supposed drama,0
riveting performance incredibly flexible cast make love joy behold,1
jones offer brutal form charisma,1
overall tomfoolery like matter taste,0
something watching squad psychopathic underdog whale tar unsuspecting lawman reach across time distance,1
serious thoughtful,1
fine documentary best extends warm invitation unfamiliar world illuminates fully allows larger implication journey sink unobtrusively,1
solondz may convinced something significant say talking talk appeal,0
film appeal lot casting juliette binoche sand brings role pale dark beauty characteristic warmth,1
antonia assimilated newfangled community film settle becomes compulsively watchable guilty pleasure daytime drama sort fashion,1
lighthearted feel good film embrace time honored truth powerful thing life love,1
fact screen alive seems likely broomfield interviewee even much longer,1
questioning election process payami graphically illustrates problem fledgling democracy also strength sense freedom iranian people already posse without access ballot box,1
make minute feel like three hour,0
usually bad sign director abandon script go moment take olympia wash based filmmaker anne de marcken marilyn freeman make project interesting,1
reason exist employ hollywood kid people owe favor famous parent,0
modest masterpiece,1
death smoochy often funny even remarkable integrity devito misanthropic vision,1
many parent teen preteen kid could bond watching walk remember could young romantic date,1
cacoyannis perhaps effective creating atmosphere dust caked stagnation labored gentility,0
dramatic crisis always succeed quest taken seriously huppert volatile performance make riveting movie experience,1
fourth series bet parent thought hoped fad long since vanished,0
maguire surprisingly effective peter spider man,1
m phoenix completely lacking charm charisma unable project either esther initial anomie eventual awakening,0
child occupied minute,1
pleasure super trooper may fleeting register strongly anybody still retains soft spot precollegiate humor,1
like original version raised notch kiddie fantasy pablum allen astringent wit,1
cleverly crafted ultimately hollow mockumentary,0
may work jaunt memory lane teen young adult grew televised scooby doo show rerun,1
make case strong education good teacher valuable way help increase average student self esteem strictly knowledge imparted,1
anyone count five film target market see dumbed concoction going,0
big idea film small shriveled,0
quite funny type movie,1
shaky close ups turkey roll stubbly chin liver spot red nose filmmaker new bobbed draw easy chuckle lead nowhere,0
offer glimpse solomonic decision facing jewish parent turbulent time save child yet lose,1
bielinsky filmmaker impressive talent,1
refreshing change usual whoopee cushion effort aimed youth market,1
end one word best describes film honest,1
watching film feel mainly suspense excitement dominant feeling something like nostalgia,1
punch seen prison bar fight become much struggle man v man brother man v man,1
may never think band camp geeky nerdy thing,0
like episode mtv undressed time creativity without substance indulgently entertaining could deeper,1
gripping handsome execution much k unique memorable,1
trial henry kissinger remarkable piece filmmaking get,1
feel choke leash around neck director nick cassavetes give good hard yank whenever want feel something,0
never thought say much rather watch teen poking genitals fruit pie,0
white developed character much caricature one dimensional buffoon get laugh nothing else,0
small independent film suffering severe case hollywood itis,0
chateau cleverly probe cross cultural difference gaul yank,1
amid shock curiosity factor film corny examination young actress trying find way,0
allowed use word new title original character siuation joke entire movie,0
film jolt laugh audience cattle prod,1
collected moment coherent dialogue still add time required boil four minute egg,0
seem get anywhere near story center,0
dirty deed david caesar stepped mainstream filmmaking assurance worthy international acclaim every cinematic tool well control driven natural sense work screen,1
gra intera e entre seus personagens filme torna se n apenas uma hist ria divertida sobre uma curiosa persegui ma tamb um belo estudo de personagens,1
scotland look wonderful fan often funny fanatic showdown sure beat bad day golf,1
dong never push insight beyond superficial tension dynamic dissecting film settle easily along contour expectation,0
certain ghoulish fascination generates fair amount b movie excitement,1
lovely amazing holofcener deep uncompromising curtsy woman know likely said done love piece trust,1
film flat,0
heard fan first men black come away hating second one wonder felt like movie,0
clever blend fact fiction,1
chocolate factory without charlie,0
allegory concerning chronically mixed signal african american professional get overachieving could intriguing supernatural trapping obscure message,0
time beautiful film watch interesting time captivating take loss loneliness,1
scorsese give u character worth giving damn,0
carrying wafer thin movie nimble shoulder chan wade putrid writing direction timing smile say stay positive maybe channel one greatest picture drunken master,0
dumb movie dumb character dumb thing really dumb see going,0
irritating soul searching garbage,0
succeeds bullock grant made share silver screen,1
movie undone filmmaking methodology experimental enough alienate mainstream audience ringing cliched hardened indie head,0
script please,0
must see side political spectrum,1
stevens vibrant creative instinct difference countless flick guy doll,1
genre well established make movie fresh smart writing skewed character title performance kieran culkin,1
movie obviously seek create excitement flick jules verne league sea george pal version h g well time machine storytelling prowess special effect listless,0
liotta put pound role completely transformed smooth goodfellas image,1
black austin power prefer think pootie tang budget sa da tay,1
shainberg weave carefully balanced scenario controlled neither character weirdly sympathetic manages tender darkly comic,1
incredibly clever superbly paced caper filled scam within scam within scam,1
film bright flashy right way,1
clunky busy ribbing truly entertaining,0
direct void release heading nowhere,0
two lead almost good enough camouflage dopey plot much naturalistic small talk delivered almost muffled exchange eventually lulling effect,0
certain sexiness underline even dullest tangent,1
never engaging utterly predictable completely void anything remotely interesting suspenseful,0
pacing often way many bona fide groaner among laugh,0
smart steamy mix road movie coming age story political satire,1
japan premier stylist sex blood hit audience may demented film date,1
movie like scorsese mean street redone someone ignored favor old juvenile delinquent paperback title like leather warrior switchblade sexpot,0
despite closed door hanky panky film essentially juiceless,0
charming slight comedy,1
predictably soulless techno tripe,0
movie little tired maybe original inspiration run course,0
director cut add minute take great film turn mundane soap opera,0
robin williams departs fun friendly demeanor exchange darker unnerving role,0
ram das fierce grace mould example coming documentarians overlooked pitfall endeavour,0
stanley kwan directed one best gay love story ever made one best love story stripe,1
phoned business usual,0
doubting highly ambitious personal project egoyan also one next best work feel clumsy convoluted,0
solid watchable first feature director peter sheridan,1
interesting story pertinent cinematically unique message told fairly well scored perfection found struggling put finger elusive missing thing,1
quietly introspective portrait self esteem employment shame losing job,1
recall quiet freak out like l avventura repulsion,1
may cause bite tongue keep laughing ridiculous dialog oh convenient plot twist,0
bottom line nemesis film series fan undoubtedly enjoy uncommitted waste time,0
suffice say seeing movie imax form acquainted tiniest detail tom hank face wife,1
one funniest motion picture year also one curiously depressing,1
abandon pretense creating historical context waltz hectic soap ups down heavy breathing two artist,0
dramatically lackluster,0
meant reduce blake philosophy tragic coming age saga punctuated burst animator todd mcfarlane superhero dystopia,1
film well worth seeing talking singing head,1
group self absorbed woman mother daughter featured film think nothing wrong performance whiney character bugged,0
alain choquart camera barely stop moving portraying turmoil time giving conduct perpetual sense urgency film take nearly three hour unspool funny irritating,1
broomfield reminds u beneath hype celebrity high life conspiracy mystery couple bright young men promising talented charismatic tragically doomed,1
maintains sympathy otherwise challenging soul letting share one room world,1
gentle engrossing character study,1
like film almost anthropologically detailed realization early suburbia significant without overstated,1
broad melodramatic estrogen opera pretty toxic right,0
genial conceit one rare picture root throughout dearly hoping rich promise script realized screen never fully,0
sure mainstream audience baffled least minimal appreciation woolf clarissa dalloway hour represents two well spent,1
ultimately repellent fully endear american art house audience notable stylistic austerity forcefulness,1
cinematic sleeping pill impressive potency,0
silly sophomoric ensnare target audience,0
fun adventure movie kid age like adventure,1
pitiful slapdash disaster doa dud frame one,0
anyone remembers interested one man response stroke ram das fierce grace worth seeking,1
boisterous daft documentary,1
story set sea ghost ship pretty landbound leaden acting dull exposition telegraphed surprise,0
chilling movie without oppressive gore,1
people jessica recognizable true real life never sure thing work,1
bartlett hero remains reactive cipher opening man head heart imaginable reason film made,0
pratfall aside barbershop get greatest play timeless spectacle people really talking,1
death smoochy get williams usual tear smile sneer bile spectacle nothing short refreshing,1
candy like taste fading faster cent bubble gum realized throwaway movie stand test time trifle,0
idea revolution compelling execution,0
compared series spectacular belly flop screen runteldat something triumph,1
quasi documentary french filmmaker karim dridi celebrates hardy spirit cuban music,1
unsurprisingly way work make woman look like stereotypical caretaker moral teacher instead serious athlete,0
may inspire younger moviegoer read stevenson book treasure,1
since dahmer resort standard slasher flick thrill mind killer miss major opportunity truly revelatory psyche,0
pumpkin strut courage pinned huckster lapel yellow streak mile wide decorates back,0
impact armenian genocide diluted much stage business modern day,0
lack substance make heart,1
film produced jerry bruckheimer directed joel schumacher reflects worst shallow style wildly overproduced inadequately motivated every step way demographically targeted please every one one,0
recommend film,1
result gaudy bag stale candy something halloween died,0
rarely leukemia looked shimmering benign,0
artful yet depressing film make melodramatic mountain molehill missing bike,0
prurient plaything aside little love english trifle,0
lazily directed charles stone iii leaden script matthew cirulnick novelist thulani davis,0
hook drama within drama unsolved murder unresolved moral conflict jockey spotlight,1
world traveler might go anywhere new arrive anyplace special certainly honest attempt get something,1
attempt build pressure cooker horrified awe emerges simple fact movie virtually nothing show,0
sophisticated literate picture usually amusing little catch,1
stuffy full morally ambiguous nothing shout,0
swiftly deteriorates terribly obvious melodrama rough hewn vanity project lead actress andie macdowell,0
small moment flashback add much trite observation human condition,0
one worst movie year watching painful,0
premise extremely bad taste film supposed insight poorly thought substance free even high school senior taking first psychology class could dismiss,0
reno take credit movie success one cool actor never seems aware coolness,1
resident evil game may set new standard thrill suspense gore video game movie really succeeds third,0
unique residence home movie people live carved comfortable niche world kind enough share,1
well made mush hearted,0
premise kegger comedy probably sounded brilliant four six pack pitcher margarita film must written thrall vicious hangover,0
intrigued politics film every bit fascinating flawed,1
woven together handsomely recalling sixty rockumentary milestone lonely boy look back,1
sam mendes become valedictorian school soft landing easy way,0
aggravating tedious,0
eight crazy night showcase sandler many talent,1
monster born made,0
supernatural mystery know whether want suspenseful horror movie weepy melodrama end neither fails endeavor,0
fifty minute tedious adolescent melodramatics followed thirty five minute inflated nonsense,0
dashing resourceful hero lisping reptilian villain big fight big hair lavish period scenery story complicated enough let bask cleverness figure,1
persnickety preteen enjoy nonthreatening thrilling adventure,1
brings spectacular completion one complex generous subversive artwork last decade,1
bursting constraint source one adapted television movie actually look belongs big screen,1
horrid little propaganda film fascinating connection serb also network american right wing extremist,0
though never rise full potential film still offer great deal insight female condition timeless danger emotion repressed,1
bravura exercise emptiness,0
initial strangeness inexorably give way rote sentimentality mystical tenderness becomes narrative expedience,0
jackson try keep plate spinning best bouncing back forth help become bit tedious even breathtaking landscape villainous varmint distract ricocheting,1
sometimes blood seems tired protagonist still pulse never disappears entirely picture cross finish line winded still game,1
one year best film featuring oscar worthy performance julianne moore,1
nothing interesting unfaithful whatsoever,0
exaggerated broad come annoying rather charming,0
sort cute cloying material far zhang forte show,0
valueless kiddie paean pro basketball underwritten nba,0
year happiest surprise movie deal real subject always surprising way,1
one say balding year old actor playing innocent boy carved log,0
premise abandon hold promise delivery complete mess,0
underworld urban angst derivative martin scorsese taxi driver goodfellas film speaks,1
movie seems motivated desire match mortarboard dead poet society good hunting story,0
undisputed exactly high gripping tidy little movie take mr hill higher,1
end sort loved people onscreen even though could stand perhaps film seen conversation starter easy one review,0
tale passionate tumultuous affair musset unfolds sand masculine persona love life beauty take form,1
think riot see rob schneider young woman clothes enjoy hot chick,0
big giant title opening credit elmer bernstein perfectly melodic score haynes get everything right,1
moretti rare common man artist wise enough recognize thing world complex turn fragile happiness,1
giddy whimsical relevant today year ago,1
call full monty ice underdog sport team formula redux,1
number patient doctor pic cover usual ground,0
originality sorely lacking,0
think laughed loud talking slapstick comedy pretty big problem,0
confession always coherent sharply comic surprisingly touching hold gong,1
sewer rat could watch movie skeeved need shower,0
graphic sex may attracting audience unfaithful gripping performance lane gere keep awake,1
plot romantic comedy boilerplate start finish,0
sem se preocupar em criar momentos melodram ticos para arrancar l grimas espectador pianista um filme triste sem que para isso precise ser emocionante,1
lift film high run filth gangster flick refusal recognise signpost discovering way bitter end without map,1
movie would seem le trifle m sugarman followed defiance saccharine,0
respectable venture term lacking broader vision seen certain trek film cross mainstream audience,1
wild comedy could spring demented mind writer john malkovich,1
film something interesting odd would probably work better real documentary without insinuation mediocre acting fairly trite narrative,0
hard especially grateful freedom film like,1
best festival cannes bubble excitement festival cannes,1
era big star high production value standard procedure narc strike defiantly retro chord outpaces contemporary daring verve,1
quite recommend patched together almost kind movie make want like,0
dirty joke provide funniest moment oddly sweet comedy jokester highway patrolman,1
hardman grating mannered onscreen presence especially unfortunate light fine work done rest cast,0
screenwriter responsible one worst movie one year directs equally miserable film following year hard time believing coincidence,0
morrissette performed difficult task indeed taken one world fascinating story made dull lifeless irritating,0
lame haphazard teen comedy,0
road paved good intention lead video store,0
really one good idea movie director run present unforgettable visual panache,1
gripping movie played performance understated touching,1
small gem belgium,1
one strained caper movie hardly fun watch begin vaporize memory minute end,0
