Summary,Sentiment
shunji iwai lily chou chou beautifully shot ultimately flawed film growing japan,0
movie notable observation long sitting still,0
k may hold lot water submarine epic hold even le turn elegiacally soggy saving private ryanovich,0
lackadaisical plotting mindless action benjamin evokes bottom tier blaxploitation flick,0
huppert show steal make meal channeling kathy baker creepy turn repressed mother boston public much woman augustine,1
delicately observed story deeply felt masterfully stylized triumph maverick director,1
say lot filmmaker wacky without clobbering audience head still maintain sense urgency suspense,1
charm kevin kline story put old fashioned value microscope something creepy movie,0
even bother rent video,0
whole damn thing ripe jerry springer crowd pretty cynical condescending,0
like leafing album photo accompanied sketchiest caption,0
without ever becoming didactic director carlos carrera expertly weave novelistic story entangled interrelationship complex morality,1
striking jolie performance never let character become caricature even radioactive hair,1
film boast least good idea feature decent performance result disappointing,0
even madonna swept away blue lagoon,0
post philosophical message personal freedom first might palatable intended,1
film solid job slowly steadily building climactic burst violence,1
minimal imagination could restage whole thing bathtub,0
gentle compassionate drama grief healing,1
smart arch rather cold blooded comedy,1
bruin art thou style cross country adventure sporadic burst liveliness slapstick ear pleasing song soundtrack,0
stink start finish like wet burlap sack gloom,0
moving solidly entertaining comedy drama bolster director co writer juan jos campanella reputation united state,1
mush college friend genre big chill together contrivance overwrought emotion soap opera,0
dashing absorbing outing one france inventive director,1
something fishy seasonal holiday kid movie derives moment convincing emotional gravity scene santa give gift grownup,0
bill morrison decasia uncompromising difficult unbearably beautiful,1
effectively creepy fear inducing fear reducing film japanese director hideo nakata take superstitious curse chain letter actually applies,1
ozpetek offer aid subtext skim reality gay sex present yet another tired old vision gay community inclusive world uptight middle class bore like antonia feel good,0
one movie catch something bigger namely archetypal desire enjoy good trash every,1
movement yuks much anything,0
tasty appetizer leaf wanting,1
cantet beautifully illuminates mean sometimes inside looking time outside looking,1
title helpfully offer succinct review read anywhere,0
beer given right line charm paint wall script go wrong several key juncture,0
see robert de niro singing dancing west side story show tune choose reaction sure funny b sure pathetic,0
set romantic comedy apart hollywood romantic comedy low key way tackling seems like done death material,1
none character plot line fleshed enough build interest,0
wit hoopla festival cannes offer rare insight structure relationship,1
spirit season assign one bright shining star roberto benigni pinocchio guarantee wise men following,0
traditional moviemaking way done lot careful period attention well welcome wit,1
purely enjoyable might even notice fairly straightforward remake hollywood comedy father bride,1
exciting watch two last place basketball team playing one another final day season,0
overblown clunker full bad joke howling cliche number action sequence,0
home movie film equivalent lovingly rendered coffee table book,1
painfully funny ode bad behavior,1
gem romantic crime comedy turn clever amusing unpredictable,1
good film must baffled folk marketing department,1
fire torpedo clancy hole scripters deserve oscar nerve raked acting crackle line impressive staging hardware make robust scary entertainment,1
gently humorous touching,1
director kapur filmmaker real flair epic landscape adventure better film earlier english language movie overpraised elizabeth,1
movie generic virtue despite lot involved talent seems done number,0
whiny downer corruscating commentary,0
annals movie film odd inexplicable unpleasant,0
enchanting spectacular potter fan anxious ride hogwarts express toward new year magic mischief,1
mature fatal attraction complete indecent proposal relevant week unfaithful intimate universal cinema,1
written flatly david kendall directed barely something mary co writer ed decter,0
full experience love story murder mystery expands meditation deep deception innocence,1
long clunky ending force audience fidget ten pseudo serious minute waiting ending credit deleted scene montage break audience awkward silence,0
sunshine state lack kind dynamic limbo offer way rather indulgent piece,0
want thought subversive little indie film quality modern situation comedy,0
tired predictable bordering offensive waste time money celluloid,0
animation increasingly emphasizes computer cool film take stand favor tradition warmth,1
movie cute take seriously still feel like made stoned college student,0
quietly moving look back iranian american,1
majidi get uniformly engaging performance largely amateur cast,1
film trailer also looked like crap crap expecting,0
psychological thriller genuinely spooky premise average cast actor bill paxton directing debut creepy slice gothic rural americana,1
wickedly funny visually engrossing never boring movie challenge u think way consume pop culture,1
satire smug self congratulatory kind let audience completely hook,0
kid bratty sympathy film grows finale little change ring hollow,0
coarse cliched clunky trifling romantic comedy opposite attract better reason screenplay demand squanders charm star hugh grant sandra bullock,0
bleakly funny character touching refusing pity memorialize,1
writer director night shyamalan ability pull together easily accessible story resonate profundity undeniable,1
somewhere middle film compels demme experiment harvest movie moment gem field roughage dominates,0
pray passion material nonetheless appreciates art reveals music scene transcends culture race,1
klein charming comedy like american pie dead election delivers one saddest action hero performance ever witnessed,0
bibbidy bobbidi bland,0
interesting thoroughly unfaithful version carmen,0
romantic comedy plotline straight age cinderella story single surprise sleeve somehow manage get spell,1
otherwise intense twist turn thriller certainly hurt talented young gaghan resume,1
film capture perfectly hope dream little boy baseball field well grown men sit stand,1
emerges unsettling picture childhood innocence combined indoctrinated prejudice promise compelling piece demonstrates well child trained live carry parent anguish,1
veers uncomfortably close pro serb propaganda,0
literary purist may pleased far mainstream matinee style entertainment go bang job pleasing crowd,1
romantic comedy enriched sharp eye manner more,1
exaggerated enough parody gross flick college flick even flick general merely indulges worst element,0
dense enigmatic elusive stagy stilted,0
meant star war fan give good time,1
like sequel take worked last time repeat add character stunt stuff attempt camouflage sameness,0
yet actress quite singer,0
smug artificial ill constructed fatally overlong never find consistent tone lack bite degenerating pious preachy soap opera,0
jackson accomplished amazing technical level,1
sentimental entirely irresistible portrait three aging sister,1
piquant meditation thing prevent people reaching happiness,1
wild endearing masterful documentary,1
truth tell seen half dozen horror film nothing seen,0
plenty scene frida work rarely involve title character,0
type stunt academy love powerful political message stuffed otherwise mediocre film,0
rarely film title served dire warning,0
refreshing korean film five female high school friend face uphill battle try take relationship deeper water,1
genuinely touching realistic kind love,1
misstep take otherwise fascinating riveting story send path mundane,1
suspension disbelief bad screenwriting film pack wallop latter,0
wes craven presence felt craven nightmare elm street hill eye sad schlock merchant deadly friend,0
poignant artfully crafted meditation mortality,1
ou got love disney pic little cleavage one heroine feisty principled jane,1
austin power part extremely funny first part making flaw come later,1
stitch bad mannered ugly destructive little cute factor mind ugly problem character loveable otherwise,0
dumb importantly scary,0
mild mannered material given pedestrian spin director needed touch flamboyant outrageous,0
could easily become cold calculated exercise postmodern pastiche wind powerful deeply moving example melodramatic moviemaking,1
look feel like low budget hybrid scarface carlito way,0
plain silly,0
soderbergh skim fat film left rich stew longing,1
pianist lack quick emotional connection steven spielberg schindler list mr polanski creates image even haunting mr spielberg classic,1
rough trade punch judy act play well play worse,0
still pretentious filled subtext entertaining enough face value recommend anyone looking something different,1
gooding offer desperately ingratiating performance,0
maybe asking much movie truly going inspire want little,0
wow knew charles dickens could light hearted,1
make movie work admittedly limited extent commitment two genuinely engaging performer weaver lapaglia excellent kind low key way allows u forget actually movie folk,1
definite weakness like rather unbelievable love interest meandering ending caper film riveting brisk delight,1
sad thing knockaround guy lame aspiration grasping coolness vibe fact film flippant slick think,0
minute zing along vibrance warmth,1
respective charm sandra bullock hugh grant worn threadbare,0
film hard dismiss moody thoughtful lit flash mordant humor,1
start slowly adrien brody title role help make film conclusion powerful satisfying,1
film striking ending one realizes long way go fully understand sexual permutation involved,1
cut layer soap opera emotion find scathing portrayal powerful entity strangling life people want believe,1
film fails fulfill ambitious goal nonetheless sustains interest long build expository material,1
something poignant artist plus year taking effort share impression life loss time art u,1
majidi poetic love story ravishing consciousness raiser bit draggy time,1
sophomore slump director sam mendes segue oscar winner oscar winning potential smooth sleight hand,1
conversation hold goodwill close relatively slow come point,1
flavorful romantic could call martha got groove back assuming ever one begin,1
cast low wattage none character come big setting remains indistinct,0
deep intelligence warm enveloping affection breathe every frame,1
x potion give quickly named blossom bubble buttercup supernatural power include extraordinary strength laser beam eye unfortunately enable discern flimsy screenplay,0
heartbreaking heartwarming simple fable done artless sytle tremendously moving,1
director jay russell weighs capricious fairy tale heavy sentiment lightweight meaning,0
something splendid looking particular film viewer expects something special instead get sci fi rehash,0
vera created provocative absorbing drama reveals curse self hatred instilled rigid social more,1
movie friday fan critic damned already like sort thing sort thing,0
reach wholly believable heart wrenching depth despair,1
alan fellow survivor idiosyncratic enough lift movie playwriting premise,1
devoid pleasure sensuality cannot even dubbed hedonistic,0
familiar basically sort cautionary tale old angel dirty face appeared,0
unintentional parody every teen movie made last five year,0
sometimes smart often sophomoric,0
ugly revolting movie,0
solid cast assured direction complete lack modern day irony,1
humorless journey philosophical void,0
movie thrill touch make laugh well,1
amateurish quasi improvised acting exercise shot ugly digital video,0
rule attraction get u drunk party favor sober u transparent attempt moralizing,0
fun little timewaster helped especially cool presence jean reno,1
careful pace seemingly opaque story may satisfy every moviegoer appetite film final scene soaringly transparently moving,1
mood fun bad movie might want catch freak matinee,0
watching film one left inescapable conclusion hitchens obsession kissinger bottom sophisticated flower child desire purge world tooth claw human power,1
little weak funny,0
lovely film lovely performance buy accorsi,1
goldmember none visual wit previous picture look though jay roach directed film back taxicab,0
graceful contemplative film gradually artfully draw u world personal political get fatally intertwined,1
million dollar heaped upon project vast proportion need reap reward spiffy bluescreen technique stylish weaponry,0
movie soft percolating magic deadpan suspense,1
dreary highly annoying body appeal one,0
full wrong choice shake head disbelief worry classic oliver parker intends mangle next time,0
fan walked muttering word like horrible terrible much fun dissing film mind ticket cost case zero,0
drowns sap,0
brings awareness issue often overlooked woman depression,1
brief minute need x le blab,0
director claude chabrol become master innuendo see think see,1
shambling charm cheerfully inconsequential diversion,1
origin story well told character disappoint anyone value original comic book action scene thing fall apart,0
version classic like predecessor pleasure still plentiful,1
pool drowned boredom,0
crystal de niro manage squeeze good laugh enough make silly con job sing,0
psychologically savvy,1
film lapse often sugary sentiment withholds delivery pell mell pyrotechnic punchy style promise,0
piece mildly entertaining inoffensive fluff drift aimlessly minute lodging crack ever growing category unembarrassing unmemorable,0
beautiful timeless universal tale heated passion jealousy betrayal forgiveness murder,1
noble failure,0
walsh quite negotiate many inconsistency janice behavior compensate sheer force charm,0
whole heartedly recommend everyone see movie historical significance alone,1
really add much,0
simultaneously heartbreakingly beautiful exquisitely sad,1
oddity sure one might wind remembering degree affection rather revulsion,1
year since hr made eddie murphy movie star man aged day showboating wise cracker stock persona sure getting old,0
part film hold pretty well,1
partly schmaltzy number romantic comedy partly shallow rumination emptiness success entirely soulless,0
essentially film weak detail strong personality,0
rabbit proof fence noyce tailored epic tale lean economical movie,1
unfunny downright repellent,0
fast paced suspenseful argentinian thriller shadow side play,1
taking entertainment tonight subject matter giving humor poignancy auto focus becomes gut bustingly funny crushingly depressing,1
need impressionistic cinematography exhilarating point view shot fewer slow motion grandeur shot quick cut edits often detract athleticism,0
screenwriter dan schneider director shawn levy substitute volume primary color humor bite,0
taste run difficult film absolutely miss,1
fails making character understandable getting skin exploring motivation well end film grows dull character whose fate hard care,0
never huge fan dickens page novel surprised much pleasure watching mcgrath version,1
director benoit jacquot making first opera film translation tosca conveys heaving passion puccini famous love jealousy murder suicide fandango great cinematic innovation,1
unfolds series achronological vignette whose cumulative effect chilling,1
nothing widget cranked assembly line see stupid american get kick goofy brit cute accent performing age old slapstick unfunny trick,0
throwing everything except someone pulling pin grenade teeth windtalker seems ransacked every old world war ii movie overly familiar material,0
daring beautifully made,1
hard care film proposes epic tragedy plight callow rich boy forced choose beautiful self satisfied year old girlfriend equally beautiful self satisfied year old mistress,0
mildly interesting ponder peculiar american style justice play muddled derivative bother thinking,0
much smarter attentive first set,1
dreary rip goodfellas serf muddled offensive cautionary tale hispanic american,0
guess go show give filmmaker unlimited amount phony blood nothing good happen,0
fails bring much table,0
like brosnan performance evelyn come heart,1
rebellion misdirected fight culture,1
talented clever robert rodriguez perhaps put little much heart first film reserve enough second,0
mindless boring martial art gunplay little excitement zero compelling storyline,0
movie dawn dead crossed john carpenter ghost mar zombie ghoulish first train big second,0
movie comedy might work better ambition say something subject willingness,0
kind pigeonhole resisting romp hollywood rarely provides,1
beguiling evocation quality keep dickens evergreen exuberant openness express basic emotion,1
real visual charge filmmaking strong erotic spark crucial lip reading sequence,1
aaa action xxx blast adrenalin rated eee excitement vin diesel man,1
without resorting hyperbole state kissing jessica stein may best sex romance seen,1
place slightly believable love triangle difficult swallow setting disappointingly move story realm improbable thriller,0
refreshingly realistic affectation free coming age tale,1
absorbing disturbing perhaps disturbing originally intended little clarity would gone long way,1
funny film,1
tenderness piece still intact,1
literally nothing pool new grew stalker flick one appease minute,0
kinnear performance career defining revelation,1
subtle mystifying novella broad farcical,0
violent initiation rite audience much angelique opening dance guarantee karmen enthronement among cinema memorable woman,1
filled low brow humor gratuitous violence disturbing disregard life,0
transporter lively fun unapologetically dumb,1
phillip noyce actor well cinematographer christopher doyle understand delicate forcefulness greene prose screen version quiet american,1
film saved kid cute sentimentality warmth faked stately sense composition,1
nearly every attempt humor doa,0
hit every cliche come expect including assumption crazy people innocent childlike inherently funny,1
lends narcotizing bland sinister though nearly sinister biennial disney girl movie machination biennial disney boy movie,1
silly loud goofy,0
killed father would rarity hollywood actor showcase accomplishes primary goal without use special effect rather emphasizing character including supporting one,1
enjoyable average summer diversion,1
merely literally toss around sex toy offer half hearted paean empowerment repeatedly undercut brutality joke woman expense,0
though bit patchwork script production glossy rich green environment almost make picture work,0
fan series love probably want see twice,1
filmmaker keep pushing joke expense character thing fall apart,0
film exudes urbane sweetness woody allen seems bitterly forsaken,1
old fashioned thoroughly satisfying entertainment,1
overly long worshipful bio doc,0
amalgam fugitive blade runner total recall without much energy tension,0
fubar funny always laugh loud way,1
oblivious existence film would sweet indeed,0
film featuring young child threatened terrorist bomb longer pas mere entertainment,0
son bride may good half hour long come replete flattering sense mystery quietness,1
root clara paul even like though perhaps emotion closer pity,1
tender yet lacerating darkly funny fable,1
band courage face official repression inspiring especially aging hippy one included,1
artsy flourish aside narc gritty movie get day,1
borrows bit classic wait dark extremity term style movie class,1
like south border melrose place,1
one thing read rail ongoing unprecedented construction project going head quite another feel physically caught process,1
realized matter fantastic reign fire looked story making sense,0
go rail final minute wendigo larry fessenden spooky new thriller refreshingly smart newfangled variation several theme derived far le sophisticated knowing horror film,1
nice guy got taste like side bra,0
mark pellington latest pop thriller kooky overeager spooky subtly love myth,1
slow younger crowd shallow older one,0
draw big bad love solid performance arliss howard,1
film bad improve upon experience staring blank screen,0
comedy drama nearly epic proportion rooted sincere performance title character undergoing midlife crisis,1
collateral damage trash earns extra point acting,1
another useless recycling brutal mid american sport movie,0
day great bond movie good bond movie still make much better typical bond knock offs,1
overall good trying,1
story loses bite last minute happy ending even le plausible rest picture much way though refreshingly novel ride,1
denis accomplishes chilling unnerving film double portrait two young woman whose life claustrophic suffocating chilly attic inevitably consigned,1
miniscule little bleep film radar one many people check,1
empty shell epic rather real deal,0
real pleasure laid back way,1
special effect hollywood ending,1
cast delivers without sham raw nerved story,1
director peter jackson crew steeped majesty tolkien writing every frame produce new joy whether fan book,1
jeff gorgeous fluid composition underlined neil finn edmund mcwilliams melancholy music charged metaphor rarely easy obvious self indulgent,1
puzzling experience,0
lovely sad dance highlighted kwan unique directing style,1
limp along squirm inducing fish water formula go nowhere go slowly,0
even hanson brother save,0
like soft drink sitting open long much syrup enough fizz,0
auteil le dramatic equally incisive performance charismatic charmer likely seduce conquer,1
based devilishly witty script heather mcgowan niels mueller film get great laugh never expense character,1
distance throwing many red herring many false scare genuine one barely register,0
amount arty theorizing special effect german expressionist according press note render anything laughable,0
best american movie troubled teen since whatever,1
yet find actual vietnam war combat movie actually produced either north south vietnamese least got something pretty damn close,1
kudos enchanting film year,1
sometimes incisive sensitive portrait undercut awkward structure final veering toward melodrama,0
example type project robert redford lab willing lend imprimatur perhaps time rethink independent film,0
charming yet poignant tale irrevocable tie bind,1
whole lot foul freaky funny,1
hot topic plot relegated background welcome step forward sally jesse raphael atmosphere film like philadelphia american beauty,1
exercise chilling style twohy film sub inside eye preserving sense mystery,1
actress madonna one helluva singer mediterranean sparkle swept away sink,0
difficult say whether tuxedo boring embarrassing prepared call draw,0
waterlogged version fatal attraction teeny bopper set sad soggy potboiler waste talent attractive young lead,0
many miss hit ultimately find humor foible human behavior welcome return root genre depend surprise,1
buy accomplished actress big juicy role,1
life size reenactment jack chick cartoon tract always ended hippie getting tossed lake fire,1
shyamalan stop trying please mom,0
movie resolutely avoids comic possibility situation becomes one dumb high school comedy sex gag prom date,0
camera work interesting film mid low budget betrayed surprisingly shoddy makeup work,0
director juan jose campanella could turned argentine retread iris american beauty instead pull little film creates something beautiful either film,1
whatever satire lucky break aiming certainly got lost soon forgettable section quirky rip prison romp pile petty thievery like put flimsy flick like behind bar,0
minority report exactly title indicates report,0
faithful without forceful sad without shrill walk remember succeeds sincerity,1
rock great presence one battle another one battle followed killer cgi effect,0
baffling misfire possibly weakest movie woody allen made last twenty year,0
holy mad maniac mask splat man good old fashioned slash hack back,1
creepy ultimately unsatisfying thriller,0
american european cinema amassed vast holocaust literature impossible think film challenging depressing grey zone,1
measured practically like themed film oscar sweeping franchise predecessor silence lamb red dragon rate exceptional thriller,1
make joke car chase hour give u half hour car chase,0
though film scenario certainly earthshaking depiction fluctuating female sexuality two winning lead performance charm spare,1
director charles stone iii applies detail film music story line best drumline energy,1
first time director jo pedro rodrigues unwillingness define hero background motivation becomes frustrating film go,0
nicolas cage first actor lead group talented friend astray movie create ruffle already erratic career,0
ex marine walter may may shot kennedy actor raymond j barry perfectly creepy believable,1
episodic film make valid point depersonalization modern life character tend cliche whose life never fully explored,0
much adaptation nick hornby novel charm effortless pleasurable featherweight charm,1
comedy nonexistent,0
individual moment mood aimlessness actually sort amazing,1
film present interesting even sexy premise ruin many contrivance goofy situation,0
fantastic,1
terminally bland painfully slow needlessly confusing movie shot digital videotape rather film frequently indecipherable,0
ferrara strongest touching movie recent year,1
beautifully made piece unwatchable drivel,0
director shekhar kapur screenwriter michael schiffer hossein amini tried hard modernize reconceptualize thing barrier finally prove great,0
kaufman script never especially clever often rather pretentious,0
premise sooooo tired pair really poor comedic writing got huge mess,0
