Summary,Sentiment
dark dull thriller parting shot misfire,0
director chris eyre going pace usual high melodramatic style filmmaking,0
although lack detail book film pack serious suspense,1
script david koepp perfectly serviceable give story soul elevates experience mythic level,1
exciting involving rock music doc smart satisfying look inside tumultuous world,1
worth seeing weaver lapaglia,1
smith careful make fun curious owner architectural oddity instead show respect due,1
disreputable doings exquisite trapping dampened lackluster script substandard performance,0
code talker deserved better hollow tribute,0
already thin story boil surviving invader seeking existent anti virus one kind movie,0
sip vintage wine watch merchant ivory production settle nice cool glass iced tea jerry bruckheimer flick day week,1
message reflection intentional art grows vacuum many artist exist one,1
loquacious dreary piece business,0
overall effect awe affection strange urge get board uh shred dude,1
nearly surreal dabbling french simple movie taking risk choose see enjoyed ride bump creamy depth ultimate theme,1
depressing confirmation everything u object description unelected suspected along george w bush incurious uncharismatic overgrown frat boy mean streak mile wide,1
fan film uninitiated play better video sound turned,0
paint memorable image makhmalbaf keep distance character,0
two word tell know deciding see anthony hopkins,1
denying physically spectacular quality film emotional integrity performance,1
friend couple mile pabst blue ribbon beer drink ultimate redneck road trip,1
way effectively teach kid danger drug think project like unfortunately r rated paid,1
flashy gadget whirling fight sequence may look cool distract flawed support structure holding equilibrium,0
build feel good fantasy around vain dictator madman putting say least mention inappropriate wildly undeserved,0
splatter movie probably reasonably good time salton sea,0
character paper thin plot cliched contrived make least favorite james bond movie seem cleverly plotted usual suspect,0
scientific law discerned producer would well heed mediocre movie start drag soon action speed explosion start fall piece,0
exactly bee knee,0
though entertaining audacious moment movie wildly careening tone extremely flat lead performance little salvage filmmaker flailing reputation,0
harrowing movie parent know button push,1
make aborbing arguable case man greatness,1
summer clone harvard man something rare riveting wild ride relies special effect,1
like abstract art film make statement easily accessible way unless prewarned would possible reasonably intelligent person sit tidal wave imagery get vision,0
writer director randall wallace bitten anyone else could chew movie veers like drunken driver heavy traffic,0
watching spirited away like watching eastern imagination explode,1
movie suffers two fatal ailment dearth vitality story shapeless uninflected,0
compelling moving film respect audience source material,1
one greatest romantic comedy past decade,1
ararat feel like book report,0
coppola directorial debut incredibly layered stylistic film despite fairly slow paced almost humdrum approach character development still manages least decent attempt meaningful cinema,1
piccoli performance amazing yes symbol loss denial life arm length film seem irritatingly transparent,0
funny touching film gorgeously acted british cast rival gosford park,1
writer director john mckay ignites charming chemistry kate jed veers sodden melodrama punctuated violin disastrous kate jealous female friend become downright despicable,0
thing movie try get audience buy fly intelligent viewer,0
offer enough playful fun entertain preschool set embracing wholesome attitude,1
two week notice appeal beyond sandra bullock vehicle standard romantic comedy,1
pain loneliness insecurity screenwriting process vividly painfully brought slovenly life self deprecating biting witty feature written charlie kaufman twin brother donald directed spike jonze,1
story ultimately take hold grip hard,1
supposed post feminist breezy end tedious chatter parrot raised oprah,0
deflated ending aside much recommend film,1
film offer intriguing premise,1
bogdanovich tantalizes offering peep show life era creme de la celluloid,1
contains humor characterization poignancy intelligence bad sitcom,0
film like sitting downtown caf overhearing bunch typical late twenty somethings natter nothing desperately wishing could change table,0
tell almost immediately welcome collinwood going jell,0
head hand wondering lee character go bank manager save everyone misery,0
flashbulb editing cover absence narrative continuity undisputed nearly incoherent excuse get closing bout time impossible care win,0
gifted crudup perfect face play handsome blank yearning find cipherlike personality bad behavior would play fine movie knew,0
share first two film loose jointed structure laugh loud bit far,0
surely one frantic virulent foul natured christmas season pic ever delivered hollywood studio,0
laugh quite hour half come feeling strangely unsatisfied feel like ate reeses without peanut butter,0
every sequel skip two hour gained consider review life affirming,0
come surprise movie scary real damn funny either,0
nothing substantial fitfully clever doodle,0
director uwe boll writer robert dean klein fail generate interest unsympathetic hero caught intricate plot cleverly worked cannot overcome blah character,0
path may familiar first time director denzel washington top notch cast manage keep thing interesting,1
wake saving private ryan black hawk soldier likely heartily sick mayhem cage war weary marine,0
hard believe something short could flabby,0
grimly competent stolid earnest military courtroom drama,1
cumulative effect movie repulsive depressing,0
expect old lame old slasher nonsense different scenery,0
tuxedo miscalculates badly forcing star play second fiddle dull effect allow suit come life,0
hampered lifetime channel kind plot lead actress depth,0
film filled humorous observation general absurdity modern life seen eye outsider deftly manages avoid many condescending stereotype often plague film dealing mentally ill,1
consistently funny irresistible junior high way consistently free gag would force give millisecond thought,1
movie captivating detail performance foreman barking mad taylor thewlis smoothly sinister freddie bettany mcdowell hard eyed gangster,1
part comedy part drama movie wind accomplishing neither full leaf u feeling touched amused several moment idea nevertheless dissatisfied movie whole,0
pretty linear makeup deep bogdanovich tie together efficiency affection period,1
rare movie intelligent one every regard except storyline everything good ultimately scuttled plot boring obvious,0
happily stay close ground spare simple manner pummel u phony imagery music,1
tender heartfelt family drama,1
spider man growing strange hair getting mature body finding necessary hide new secretion parental unit,1
poetic heartbreaking,1
steve irwin method ernest hemmingway accelerated speed volume,1
shot largely small room film gentle unforced intimacy never becomes claustrophobic,1
like four lead actor lot manage squeeze laugh material treading water best forgettable effort,0
character clinically depressed abandoned slim hope dream,0
self congratulatory imax rah rah,0
watching gentle mesmerizing portrait man coming term time barely realize mind blown,1
never inspires interested detachment,0
better described ghost story gone badly awry,0
film immensely enjoyable thanks great performance steve buscemi rosario dawson,1
final result make adequate entertainment suppose anyone seen chicago stage leave theater feeling watched nothing pale imitation real deal,0
movie straddle fence escapism social commentary side fall short,0
grating emaciated flick,0
thanks scott charismatic roger eisenberg sweet nephew roger dodger one compelling variation company men,1
film epic scale intimate feeling saga ups down friendship,1
jacquot tosca treat,1
affable undernourished romantic comedy fails match freshness actress producer writer previous collaboration miss congeniality,0
beauty alexander payne ode everyman detail,1
film faint heart conservative spirit rest u especially san francisco lover spirited film must see,1
although fairly involving far go film end much fresh say growing catholic really anything,1
tell show,0
time crazy night come close hitting comedic satirical target offbeat musical number,0
perfectly pleasant slightly pokey comedy,1
spiritual rebirth bruising defeat vincent odyssey resonates profound way comparable classic film jean renoir,1
lan yu certainly serviceable melodrama even try greatness happy together shoot miss,0
historical filmmaking without balm right thinking ideology either liberal conservative mr scorsese bravery integrity advancing vision hardly underestimated,1
film real appeal clooney fan adventure buff moviegoer enjoy thinking compelling question easy answer,1
journey memory celebration living sobering rumination fatality classism ignorance,1
even dumb action movie standard ballistic eck v sever dumb action movie,0
visually striking viscerally repellent,1
culkin exudes none charm charisma might keep general audience even vaguely interested bratty character,0
feel like light errol morris focusing eccentricity failing ultimately make something bigger scrapbook oddball,0
rock solid family fun gate extremely imaginative wane middle,1
time learn andrew turnabout fair play every bit awful borchardt coven enjoy anyway,1
death merely transition common tenet world religion deeply spiritual film tap meaning consolation afterlife communication,1
suffers lack compelling comprehensible narrative still visual treat film almost unsurpassed,1
overall film miss brilliance jelinek novel way settle merely grim,0
beautifully reclaiming story carmen recreating african idiom,1
used say sci fi movie sign tribute shyamalan gift keep watching sky next project,1
rawness vitality give considerable punch,1
movie saved unbearable lightness simplicity storytelling authenticity performance,1
stuporously solemn film,0
long dull procession despair set cello music culled minimalist funeral,0
canny derivative wildly gruesome portrait london sociopath scariest sadist,1
lot ask people sit still two hour change watching character especially rendered flat impassive manner phoenix,0
contains laugh even le surprise,0
enjoyable film family amusing cute adult kid,1
play like one conversation comic book guy simpson,0
although hate one good either safely recommended video dvd babysitter,1
movie two absorbing character engaged romance wait see end,0
interview assassin structured le documentary found relic film difficult time shaking blair witch project real time root,0
movie spends time schneider newcomer mcadams even though performance interesting funnier,0
story bogus character tissue thin,0
de palma bad really bad femme fatale rank worst done,0
though particular interest student enthusiast international dance world music film designed make viewer age cultural background rhythmic ability want get dance,1
though opera take place mostly indoors jacquot seems unsure evoke sort naturalism set,0
red dragon never cut corner,1
best thing said picture cute moment,0
one fantastic educational documentary,1
word frankly dear give damn never appropriate,0
lazy filmmaking director taking hand approach shaped story show u compelling,0
walter hill pulpy stylized boxing melodrama undisputed nearly overcomes questionable ring match solid fight choreography gritty prison authenticity,0
boisterous comedy serf cruel reminder fate hundred thousand chinese one qualify terrible tragedy,1
awkward sincere ultimately win,1
downbeat period perfect biopic hammer home heavy handed moralistic message,0
e work flabbergasting principal year old robert macnaughton year old drew barrymore year old henry thomas convince u existence wise wizened visitor faraway planet,1
dopey movie clothed excess layer hipness,0
whole talking animal thing grisly,0
turn pretentious fascinating ludicrous provocative vainglorious,0
leanest meanest solondz misanthropic comedy,1
best occurs often michael moore bowling columbine rekindles muckraking soul searching spirit sick society journalism,1
trudge theater feeling though rode zipper eating corn dog extra large cotton candy,0
found growing frustrated detached vincent became abhorrent,0
collapse mr taylor try shift tone thriller rush,0
author devotee probably find fascinating others may find baffling,0
us pain violence war background material color,0
worth cheering breakthrough devoid wit humor,0
genuinely moving wisely unsentimental drama,1
problem antwone fisher screenplay written antwone fisher based book antwone fisher,0
film open maggot crawling dead dog place metaphor,1
mild reluctant thumb,0
best film remains shortest hole make many point film feel le repetitive,0
complex psychological drama father return son home decade away,1
perfect film like sick comedy snide,1
highly watchable giggly little story sweet edge,1
professionally speaking tempting jump ship january avoid ridiculous schlock like shoddy suspense thriller,0
though many tense scene trapped prove distressing suspenseful,0
story friendship proceeds way watching soap opera rather chronicle ups down accompany lifelong friendship,0
sex ironically little story becomes something lame try evade responsibility never ever leave large dog alone toddler never mind boob fantasti,0
despite annoyance capable clayburgh tambor really great job anchoring character emotional reality middle age,1
uneven performance spotty script add biting satire teeth,0
bittersweet drama limbo grief truth telling open door liberation,1
nicholas nickleby celebrates human spirit unrelenting dickensian decency turned horror scrooge,0
engaging criminal romp viewer guessing conned right finale,1
wanders map thematically stylistically borrows heavily lynch jeunet von trier failing find spark,0
harvard man semi throwback reminiscence without nostalgia sentimentality,0
predictability bland comfort food appeal film pleasant enough dish,0
moving weighty depiction one family attempt heal death child,1
film best appreciated willing endure extremely languorous rhythm waiting happiness ultimately thoughtful without much dramatic impact,0
verbinski implement every hack artist trick give u ooky spookies,0
filmmaker dana janklowicz mann amir mann area headed east far east retelling historically significant personal episode detailing one international city welcomed ten thousand german jewish refugee world democracie,1
impressive debut first time writer director mark romanek especially considering background music video,1
anyone passion cinema indeed sex see soon possible,1
begin promising meditation one america durable obsession wind slender cinematic stunt,0
movie quite simply made,0
impulse produced project commendable result uneven,0
film childlike quality feeling evoked film lukewarm quick pas,0
fast funny highly enjoyable movie,1
hokey super cool definitely hurry sit back relax laugh little one get fuzzy treat,1
let brush humanity psycho without making le psycho,1
one resurrection many,0
done liked much better first time around called professional,0
skin right yawp right grain salt,0
ramsay visually transforms dreary expanse dead end distaste character inhabit poem art music metaphor,1
always dreamed attending cannes seeing film big deal,0
plenty warmth go around music laughter love family,1
well meaning movie stand future year eloquent memorial world trade center tragedy,1
despite powerful portrayal binoche period romance suffers overly deliberate pace uneven narrative momentum,0
beautifully shot delicately scored powered set heartfelt performance lyrical endeavour,1
dignified ceo meet rustic retreat pee tree bear laughter,0
currency deriding james bond clich doddering misogynistic boy club,0
wanton slipperiness corpus amiable jerking reshaping physical time space would make great piece watch kid use introduce video art,1
though everything might literate smart never took always seemed static,1
movie barely make sense unbelievable na vet arbitrary flashback,0
vivid sometimes surreal glimpse mystery human behavior,1
hypnotically dull relentlessly downbeat laughably predictable wail pitched cadence depressed fifteen year old suicidal poetry,0
grey zone give voice story need heard sea holocaust movie film suffers difficulty,1
soggy shapeless mess dumb excuse waterlogged equivalent haunted house movie,0
movie despite rough edge tendency sag certain place wry engrossing,1
like bond outing recent year stunt outlandish border cartoonlike heavy reliance cgi technology beginning creep series,1
trying figure rule country bear universe bear bear like human hairier would tax einstein brain,0
probably stay shadow two older accessible qatsi sibling,0
men black ii creates new threat mib recycles premise,0
lauren ambrose come alive attention two stranger town honest performance realistic interaction character coming age story twist,1
argue anyone call slacker dumb insulting childish laughed much mind,1
quietly reflective melancholy new zealand film eventful summer year old girl life,1
rife nutty cliche far much dialogue,0
vaguely interesting much,0
ultimately ponders reason need story much,1
trouble making queen thoroughly modern maiden also make appear foolish shallow rather likely victim mental illness,0
michele brainless flibbertigibbet hard take spiritual quest seriously,0
lot fun undeniable energy sparked two actress working peak power,1
energetic engaging film never pretend something,1
movie usual impossible stunt many scene lean tough enough fit modern action movie,1
kaufman creates eerie sense time event night matthew killed,1
great shame talented director chen kaige chosen make english language debut film poorly plotted scripted,0
stupid derivative horror film substitute extreme gore suspense,0
exhilarating serving movie fluff,1
surprise director washington demand receives excellent performance newcomer derek luke,1
boll us lot quick cutting blurry step printing goose thing dopey dialogue sometimes inadequate performance kill effect,0
earnest earthbound slow soggy soporific visually dank crime melodrama character study would home small screen stellar cast,0
mel gibson fight good fight vietnam director randall wallace flag waving war flick core decency,1
turkey would gobble dolby digital stereo nothing else rollerball may go cinema history movie ever rest cast outshined cool j,0
lan yu seems altogether slight called kind masterpiece however completely honest open hearted film appeal anyone willing succumb,1
tone rueful compassion reverberates throughout film whose meaning impact sadly heightened current world event,1
baran transporting gripping film iran indeed director worthy companion many fine focused film emerging surprising nation,1
overall feel unlike watching glorified episode th heaven,0
chalk adoration de niro murphy pretty good time movie despite myriad flaw,1
might first sci fi comedy could benefit three company style laugh track,0
bourne identity half entertaining director doug liman colleague managed pack enough action satisfy boom bam crowd without huge sacrifice character mood,1
ub equally spoof celebrates outre aspect black culture dorkier aspect white culture even point inseparable two,1
even fan ismail merchant work suspect would hard time sitting one,0
movie asks feel sorry mick jagger sex life already one strike,0
documentary dazzling remarkably unpretentious reminder evans lost got back,1
standard gun versus martial art cliche little new added,0
touch smartly wistfully number theme least notion marginal member society might benefit helping hand friendly kick pant,1
treat depiction giving dream struggling nobody,1
brown sugar signal director rick famuyiwa emergence articulate grown voice african american cinema,1
funny thing mind contrived nonsense bit,1
kirshner monroe seem contest see bad act kirshner win close,0
complain time seeing idea repeated film bourne identity prof fresh take always possible,1
french cast marveilleux,1
badly acted blandly directed could scripted someone graduated elementary school,0
jolie give extra little something make worth checking theater especially mood something comfortable challenging,1
took predecessor get,1
one decade spanning historical epic strives intimate socially encompassing fails justice either effort three hour screen time,0
boyd screenplay co written guardian hack nick davy florid turn phrase owes guy ritchie bard avon,0
film slick superficial trend hoppy easy imagine new software program spit screenplay,0
billy crystal robert de niro sleepwalk vulgarity sequel refuse,0
filmmaker eye detail high standard performance convey strong sense girl environment,1
parade almost perpetually wasted character margarita feel like hazy high take long shake,0
see inevitable hollywood remake flattens odd intriguing wrinkle,1
murder number great movie perfectly acceptable widget,1
respite marshall keep energy humming edits unlike moulin rouge crisp purposeful without overdoing,1
boring movie boring man made watchable bravura performance consummate actor incapable boring,0
retread dead poet society,1
three protagonist miller eloquently capture moment woman life deep seated emotional need turn onto different path,1
intermittently pleasing mostly routine effort,0
movie stuck around long know something good,1
buy popcorn take nothing seriously enjoy ride,1
loud long frantic half die another day suggests bond franchise run creative wall cannot fly tunnel barrel,0
however may please love movie blare pop song young science fiction fan stomp away disgust,0
suffers decided lack creative storytelling,0
feel bad ending depressing story throw bunch hot button item viewer face asks seen hip winking social commentary,0
story preposterous believe second despite best effort everyone involved,0
loud brash mainly unfunny high school comedy,0
tug war ensues much snapshot modern china microcosm crash course movie mythology,1
urban landscape detailed sign kiosk color palette lot somber blue pink dreamy evocative,1
get bogged overly sillified plot stop start pacing,0
mixed bag comedy really described world,0
ethan hawke always fancied bastard child beatnik generation chelsea wall,0
japanese director shohei imamura latest film odd ultimately satisfying blend sophomoric sublime,1
long larded exposition somber cop drama ultimately feel flat scruffy sand titular community,0
film run little longer need muccino either notice story end tear away character smooth professional,1
number fantastic set extra costume spectacular locale disguise emptiness center story,0
baby faced renner eerily convincing bland blank man unimaginable demon within,1
maybe star power cast redundant message something aboul full frontal seems well contrived,0
spontaneity chateau sense light heartedness make attractive throughout,1
large frame imax camera lends beautifully filming teeming life reef making gorgeous film must everyone junior scientist grown fish lover,1
nothing happens happens flat character,0
compelling mix trial movie escape movie unexpected fable ensures film never feel draggy,1
film vision sport secular religion bit cloying line family community heartening way season mark new start,1
smug convoluted action comedy allow earnest moment pas without reminding audience movie,0
film improbable feat go straight video,0
veret whip smart sense narrative bluff,1
davis funny charming quirky feature film acting debut amy,1
delivers roughly equal amount beautiful movement inside information,1
manipulative feminist empowerment tale thinly posing serious drama spousal abuse,0
time commercialism squeezed life whatever idealism american moviemaking ever godfrey reggio career shine like lonely beacon,1
hour delicately crafted film impressive achievement spite river sadness pours every frame,1
rarely seen film willing champion fallibility human heart,1
disquieting relatively gore free allusion serial murder fall attempt humanize subject,0
rice never clearly defines character give u reason care,0
film travesty genre even spoof take seriously,0
mafia rap star hood rat butt ugly head regurgitation cinematic violence give brutal birth unlikely likable hero,1
kind colorful dramatized pb program frida get job done watch documentary,0
find way tell simple story perhaps simplest story way seems compelling even original,1
though moonlight mile replete acclaimed actor actress tackle subject potentially moving movie predictable self conscious reach level high drama,0
throughout mr audiard direction fluid quick,1
changing lane anomaly hollywood movie well written occasionally challenging social drama actually something interesting say,1
film center hold,0
count movie work back neck long leave theater,1
seriously rent disney version,0
much funny aggressively sitcom cute full throwaway one liner quite joke determined tv amiability allen personifies,0
crap leash far polite scale lunatic height joe dante similarly styled gremlin,0
written michael berg michael j wilson story wilson relentless wise guy time approach try way hard get tiring time,0
like star salute disney cheesy commercialism,0
scriptwriter le menace society film character,0
enchanting film present audacious tour past take within warm embrace bounty cultural artifact inside st petersburg hermitage museum,1
nothing redeeming movie,0
escape precious trapping romantic comedy infusing story real complicated emotion,1
sad nonsense without cheesy fun factor,0
although mainstream american movie tend exploit familiar every film arrives margin give viewer chance learn grow travel,1
listless desultory affair,0
succeeds providing disquiet world long dreaded completion police academy series,0
tunney allowed build uncommonly human character almost real live girl complete trouble hope,1
reaffirms life look face death,1
