Summary,Sentiment
legendary irish writer brendan behan memoir borstal boy given loving screen transferral,1
anyone want start writing screenplay follow blueprint hundred film sell highest bidder walk away without anyone truly knowing identity,0
film enthrall whole family,1
one mr chabrol subtlest work also one uncanny,1
idealistic love story brings latent year old romantic everyone,1
intensely romantic thought provoking even engaging mystery,1
earnest racial issue picture might gotten respectful critical praise different era say,0
advantage postapocalyptic setting made cheap rock pile set reign fire disadvantage also looking cheap,0
first full scale wwii flick hong kong john woo good people,0
highly amused idea come point society deemed important enough make film someone hired portray richard dawson,1
hate feeling slimed name high art,0
kid probably eat whole thing adult way ahead plot,0
brilliant work genre since uncut version sergio leone flawed staggering upon time america,1
unfortunately story actor served hack script,0
character based stock clich attempt complicate story defies credibility,0
unflinchingly bleak desperate,1
rather bland affair,0
director brian levant never stray far sitcom root skate blithely one implausible situation another pausing tie loose end bow find french poodle,0
bad company one moronic screenplay year full hole obvious even looking,0
friday next problem next friday called chris tucker need,0
deliciously mordant bitter black comedy,1
story trouble every day sketchy amount little preliminary note science fiction horror film movie fragmentary narrative style make piecing story together frustrating difficult,0
excellent performance jacqueline bisset martha plimpton grace deeply touching melodrama,1
saddled unwieldy cast character angle payoff powerful revelatory,1
feral uncomfortable,1
film old fashioned occasionally charming subtle boldface,0
entertaining british hybrid comedy caper thrill quirky romance,1
moral shrapnel mental shellshock linger long film ended,1
much lily chou chou mesmerizing plaintiveness could make weep,1
sensual funny end touching,1
embarrassment,0
stomach rough content worth checking performance alone,1
easily choice one year best film,1
despite dry wit compassion film suffers philosophical emptiness maddeningly sedate pacing,0
manages delight without much story,1
film minute running time stop shy overkill though viewer may exhausted athlete onscreen,1
trouble getting kid eat veggie,1
always remembered terrorist attack seeing film tell reason anyone bother remembering,0
lot thing,0
birot competent enough filmmaker story nothing fresh exciting,0
sink usual cafeteria goulash fart joke masturbation joke racist japanese joke,0
point way adventurous indian filmmaker toward crossover nonethnic market,1
pitch expectation time low could worse oddly cheerful particularly funny body switching farce,0
harrowing journey combat hell vividly capture chaotic insanity personal tragedy abundant human hatred spews forth unchecked,1
thanks haynes absolute control film mood buoyed three terrific performance far heaven actually pull stylistic juggling act,1
charming slight tale warmth wit interesting character compassionately portrayed,1
stake film nothing obsolete irritating notion class,0
movie stick much closer hornby drop dead confessional tone film version high fidelity,1
god bless crudup aversion taking easy hollywood road cashing movie star gorgeousness,1
jaunty fun celeb strewn backdrop well used,1
reeboir varies sweet smile angry bark said attempt wear possible pupil repetition affect kurd wore,0
tough tell abundant supply woefully hackneyed movie directed scott kalvert street gang turf war brooklyn stale cliche gratuitous violence empty machismo,0
actor relate search inner peace dramatically depicting life others onstage esther story compelling quest truth,1
one rarest kind film family oriented non disney film actually funny without hitting belt,1
sandler running empty repeating already done way often,0
portrait artist,1
documentary say alternate sexuality meant set free may require much relationship maintenance celibacy start looking good,0
creates worst kind mythologizing kind sacrifice real heroism abject suffering melodrama,0
body shaky uncertain film nevertheless touch raw nerve,0
strangely stirring experience find warmth coldest environment make crumb emotional comfort feel like course banquet,1
none meaningful memorable frosting either turn big bowl would,1
time plot grind increasingly incoherent fashion might wishing watch make time go faster rather way around,0
amid clich foreshadowing cage manages degree casual realism routinely dynamited blethyn,0
make feel weird thinking bad thing world like puppy broken leg butterfly die movie starring pop queen,0
though argue rank best herzog work invincible show back form astoundingly rich film,1
dogtown z boy evokes blithe rebel fantasy kind insouciance embedded sexy demise james dean,1
brain twister le movie movie funny weird meditation hollywood success artistic integrity intellectual bankruptcy,1
film blunt indictment part perhaps surreal campaign bring kissinger trial crime humanity,1
like afterschool special costume gianni versace mad love look better feel,0
sandra bullock despite downplaying good look carry little much cute baggage lead role troubled determined homicide cop quite pull heavy stuff,0
much meant inspirational uplifting simply distasteful audience already sharing movie mindset,0
period story catholic boy try help jewish friend get heaven sending audience straight hell,0
winning comedy wry observation long lived friendship way lose track trying please others,1
fred schepisi film paced speed slow u middle age deathly slow teen cast list brit actor worth searching,1
crush warm fuzzy might able forgive mean spirited second half,1
shyamalan offer copious hint along way myriad sign beneath familiar funny surface far bigger far meaningful story one little green men come earth harvesting purpose,1
may puzzle ardent fan,0
red dragon worthy place alongside hannibal movie hannibal would say yes like old friend dinner,1
hey arnold movie happens blow small potato time natural size pretty,0
aptly named shimmering beautifully costumed filmed production work,0
fine film would lot better stuck betty fisher left story,1
quitting offer piercing domestic drama spike sly humor,1
one rare exhilarating cinematic delight get even better hindsight mull every nuance mind,1
harris supposed star story come across pretty dull wooden,0
better staying home watching x file,0
routine rather silly,0
nachtwey clear cynicism right make realize deep inside righteousness found tough beauty,1
seen hilarity since say,0
one outstanding thriller recent year,1
somehow meant buy doting mother would shun kid travel one dangerous part world fatigue become g jane,0
got david lynch jones well check one straight twin peak action,1
nothing fresh wannabe written mr demeo produced directed film charles addessi much time movie feel authentic,1
like two predecessor koyaanisqatsi powaqqatsi cinematic collage naqoyqatsi could navel gazing film ever,1
ong chooses present ah na life slight weightless fairy tale whose unpleasant detail seem melt away face character blank faced optimism,0
plunge reality often difficult sad without sentimentalizing denying brutality transforms reality lyrical celebratory vision,1
compendium solondz worst instinct minute,0
detective story romance spiced intrigue academic skullduggery politics,1
could geeked heard apollo going released imax format word,1
worth catching griffith warm winning central performance,1
story must told retold indeed must grey zone lauded finding new ingenious angle,1
far successful considerably le ambitious last year kubrick meet spielberg exercise,1
feel inmate actually taken asylum,0
intelligent fiction learning cultural clash,1
flawed delayed martin scorcese gang new york still emerges vital work since goodfellas,1
dream cast solid female talent build seamless ensemble weak careless performance amongst,1
slight enjoyable documentary,1
wildly uneven hit miss enterprise help suspecting improvised day day basis production,0
great terrible story mr nelson made film undeniably worthy devastating experience,1
dodgy mixture cutesy romance dark satire murder mystery,0
coda every sense pinochet case split time minute minute account british court extradition chess game regime talking head survivor,1
spare yet audacious,1
meandering confusing,0
hate madonna within film first five minute lack skill presence regain ground,0
penetrating potent exploration sanctimony self awareness self hatred self determination,1
made jackass jackass,0
hamfisted romantic comedy make girl hapless facilitator extended cheap shot across mason dixon line,0
true pleasure,1
accident accidental spy solid action pic return martial art master top form,1
neither funny suspenseful particularly well drawn,0
brian de palma utterly mad cinema mad set piece mad style mad beautiful madness,1
definitely step right direction,1
shot rich shadowy black white devil chronicle increasingly amused irony relationship reluctant captor befuddled captive,1
film idea stretched point evaporation whole central section one big chase seems goal urgency filler,0
film boasted clearer memorable creepiness would gotten skin,0
bad movie happened good actor,0
excellent minute film unfortunately run,0
observant intelligence constantly vies pretension sometimes plain wacky implausibility throughout maelstrom,0
writer director burr steer emphasizes q quirky mixed result,0
much anticipated ultimately lackluster movie,0
enough wit energy geniality please fanatical adherent either side also people know nothing subject think interested,1
film despite gratuitous cinematic distraction impressed upon still good fun,1
spirit visual treat take chance bold studio standard lack strong narrative,0
demonstrates unusual power thoughtful subjective filmmaking,1
accuse kung pow misfiring since exactly want atrociously mind numbingly indescribably bad movie unfortunately prefer simple misfire,0
manages sweet wickedly satisfying time,1
good piece work often,1
different movie sometimes tedious director many viewer would like skip film buff get know,1
generally provides target audience youngster enough stimulating eye ear candy make moral medicine go,1
two hour sepia tinted heavy metal image surround sound effect people moaning,0
ill conceived expensive project wind looking like bunch talented thesps slumming,0
bland harmless,0
insomnia become one rare remake eclipse original disgrace either,1
earnest tentative even aim shock,0
sweet natured reconsideration one san francisco vital least widely recognized creative fountainhead,1
movie like high crime flog dead horse surprise obligation surprising u trying something new,0
enormously entertaining movie like nothing ever seen yet completely familiar,1
appropriately cynical social commentary aside never quite ignites,0
slapstick labored bigger setpieces flat,0
girl meet girl romantic comedy kissing jessica steinis quirky charming often hilarious yet quite genre busting film hyped play everything safe,1
liked original short story movie even hour twenty minute long go nowhere,0
gentle touching story creep heart,1
tuxedo vehicle chan mask jim carrey ala man make clothes,0
credibility level low character development non starter,0
take grandkids grandparent never worry anyone bored audience sea constant smile frequent laughter,1
truth,1
beautifully acted directed clear washington certainly new career ahead chooses,1
office work really alienating bartleby effectively make,1
stupid ill conceived badly drawn created whole new level ugly,0
feel aimless much running time late film tidal wave plot arrives leaving question wake,0
moonlight mile one get shut hug cycle,0
gushy episode h time asian perspective,0
plot maddeningly insistent repetitive piano score made want scream,0
like dickens passage mcgrath craft quite moving scene throughout resolutely dramatic variation novel,1
one smarter offering horror genre produced recent memory even far tamer advertised,1
show u slice life different yet instantly recognizable,1
insomnia one year best film pacino give one daring complicated performance,1
would easy give crush new title two wedding funeral far thoughtful film slice hugh grant whimsy,1
minute treasure planet maintains brisk pace race familiar story however lack grandeur epic quality often associated stevenson tale well earlier disney effort,1
despite gulp film fuzzy huggy,0
never know changing lane going take heck ride samuel l jackson one best actor,1
plethora engaging diatribe meaning home delivered grand passion member various household,1
seriously bad film seriously warped logic writer director kurt wimmer screenplay level,0
farce parody comedy premise comparison reality much commentary knowledge film,0
compelling portrait moral emptiness,1
marries amateurishness blair witch project illogic series contender create completely crass forgettable movie,0
though important political documentary really make case kissinger tried war criminal,1
dull inconsistent dishonest female bonding picture,0
reign fire hardly original fantasy film ever made beyond road warrior owes enormous debt alien every previous dragon drama barely make le entertaining,1
slick manufactured claim street credibility,0
follows blair witch formula hour told something creepy vague work go awry final minute,0
family friendly fantasy end little imaginative premise,0
proof filmmaker follow book go wrong better effect better acting hilarious kenneth branagh excellent sequel,1
play like badly edited minute trailer director seem get coherent rhythm going fact even seem like tried,0
appears even filmmaker know kind movie making,0
film stagecraft intimate therefore bolder otherwise calculated artifice defines overwhelms film production design,0
perfectly competent often imaginative film lack little lilo stitch spade charisma,1
could daytime soap opera actually compelling look young woman tragic odyssey,1
obvious,0
actor rock aptly named,0
visit spy movie territory like novel put examines footnote history seldom brought light screen keep guessing first frame last,1
mushy finale turn john q movie week tearjerker,0
thriller without thrill mystery devoid urgent question,0
dark gritty sometimes funny little gem,1
finally french produced read lip movie understands character must come first,1
long repetitive take way many year resolve total winner,0
amy matthew bit phony relationship film work spite,1
twohy good yarn spinner ultimately story compels,1
one lousy movie,0
pray really done subject justice,1
child adult enamored thing pokemon disappointed,0
play broad outline pandering middle age buddy comedy,0
look like travel agency video targeted people like ride bike topless roll mud worthwhile glimpse independent community guiding light,0
upside unpleasantness given labor day weekend upload feardotcom log minimal number hit,0
already seen city sea variety title worth yet another visit,1
little done support premise fling gag see one shtick,0
allen execution date close documentary give especially poignant portrait friendship never flagging legal investigator david presson,1
nine queen frighteningly capable debut genre piece also snapshot dangerous political situation verge coming head,1
inspiring heart affecting film desperate attempt vietnamese refugee living u relocation camp keep hope alive,1
tends plod,0
begin promise run aground snared tangled plot,1
people cinema finest,1
could use little humanity never lack eye popping visuals,1
thankfully film skirt rapidly deteriorating line fantasy reality take tongue cheek attitude even push croc hunter agenda,1
nair capture complexity big family trial tribulation,1
richly entertaining suggestive number metaphorical reading,1
unfortunately also good especially compared television series inspired movie,0
anyone ever fantasized space travel afford million ticket ride russian rocket catch imax offering,1
like movie child song includes line stepdad mean adjusting,1
bedroom scene viewer may find wishing could roll take nap,0
go long bog surfeit character unnecessary subplots,0
uncluttered resonant gem relay universal point without lecture confrontation,1
surface silly comedy scotland pa would forgettable clever adaptation bard tragic play,1
charming quirky leisurely paced scottish comedy except outrageous central gimmick could reject monty python meaning life,1
one hears harry shearer going make debut film director one would hope best,0
highlighted gritty style excellent cast better one might expect look list movie starring ice major role,1
invincible wonderful movie,1
clare peploe airless movie adaptation could use little american pie like irreverence,0
threat implied title pok mon ever terrifying like locust horde thing keep coming,0
casual moviegoer stumble rule expecting slice american pie hijinks starring kid dawson creek probably run screaming,0
director andrew niccol demonstrates wry understanding quirk fame healthy sense satire light fun,1
fairness must report child varying age audience never coughed fidgeted romped aisle bathroom break,1
even critically insightful godard still smarter filmmaker still work,1
renner carry much film creepy dead performance,1
stunt work top notch dialogue drama often food spittingly funny,0
lawrence stick day job better actor standup comedian,0
scooby dooby doo shaggy look sound great daphne buff fred think tough velma wow lost weight,0
focus joan raging hormone sledgehammer audience spanish inquisition madness much became mad wasted minute st century torture device,0
movie feel like pilot episode new teen targeted action tv series,0
minute film exciting scene tad slow,0
beautiful entertaining two hour get idea though kapur intended film,1
irwin earnest hard resist plea spare wildlife respect environs far worse message teach young audience probably perfectly happy sloppy slapstick comedy,1
entertaining movie effect boosted size downtown hotel take outer space,1
writer director walter hill co writer david giler try create character obvious cliche wind using punching bag,0
jonathan parker bartleby end modern office anomie film,0
giving thumb due endlessly repetitive scene embarrassment got graceful way portraying devastation disease,0
pacing glacial screenplay stiff board thing heat movie final scene,0
one movie make u pause think given acquire fast paced contemporary society,1
genuinely cool hear character talk early rap record sugar hill gang etc constant referencing hip hop arcanum alienate even savviest audience,0
unlike anime whose ardent fan outside japan seem introverted young men fantasy fetish metropolis never seems hopelessly juvenile,1
muddled repetitive ragged say far le horrifying historical reality filmmaker characteristic style,0
cast collectively successful example lovable loser protagonist show deft comic timing,1
immersive power giant screen hyper realistic image put perfect use breathtakingly beautiful outer space documentary space station,1
feature nonsensical laughable plotting wooden performance ineptly directed action sequence worst dialogue recent memory,0
hip hop rarely come alive fire breathing entity picture,0
little action almost suspense believable tension one dimensional character wazoo set described sci fi generic,0
rare movie subtle touching son room,1
especially tough grader give charitable b minus emperor club,1
deserves high mark political courage barely get artistic merit,0
markedly inactive film city conversational bordering confessional,0
deliriously funny fast loose accessible uninitiated full surprise,1
sincere exploit subject honest manipulate audience,1
splendidly illustrates ability human spirit overcome adversity,1
droll bitchy frolic poke fun price popularity small town pretension lone star state,1
recent favourite sundance white trash satire inspire affection even unlucky people never owned cassette def leppard pyromania,1
toward end sum fear morphs mundane disaster flick,0
still adam sandler little nicky many u good enough,1
awkward hybrid genre work,0
graphic carnage creation war torn croatia uncomfortably timely relevant sickeningly real,1
make great cinema interesting see one imagination lead given opportunity,1
execution pedestrian positive comment make rob schneider actually turn pretty convincing performance prissy teenage girl,0
isabelle huppert excels enigmatic mika anna mouglalis stunning new young talent one chabrol intense psychological mystery,1
one pussy as world even killer thriller revolve around group therapy session,0
restrained ribisi convinces italian though ever movie needed one actor whiny jag pump among rare one,0
psychologically rich suspenseful moral thriller stellar performance al pacino,1
demme finally succeeds diminishing stature oscar winning master lowly studio hack,0
transgressive trapping especially frank sex scene ensure film never dull rodrigues beast within metaphor ultimately rather silly overwrought making ambiguous ending seem goofy rather provocative,0
big screen scooby make silly original cartoon seem smart well crafted comparison,0
light year several warp speed level level dilithium crystal better pitiful insurrection say equal predecessor,1
kim begin overplay shock tactic bait tackle metaphor may decide high price pay shimmering picture postcard,0
amuse provoke adventurous adult specialty venue,1
fresh idea core tale,0
first time several year mr allen surpassed magic spun hollywood empress m leoni ellie,1
enormous comic potential oafish idiot impersonating aristocrat remains sadly unrealized,0
ravaging gut wrenching frightening war scene since saving private ryan recreated john woo little known story native american role second great war,1
even build insanely staged ballroom scene actor appear full regalia waltzed art film pantheon,1
might emerged hilarious lunacy hand woody allen mel brook least heyday come across lame sophomoric debut indie feature,0
romantic emotional ultimately satisfying teary eyed original,1
evokes style flash double cross made mamet house game last fall heist much fun,1
terrible film mean also far realized work,0
unfortunately appears jackie chan u influence starting show hong kong film,1
madonna still act lick,0
minor work yet denying potency miller strange fleeting brew hopeful perseverance hopeless closure,1
like vardalos corbett play role vibrant charm film directed joel zwick heartfelt hilarious way fake,1
grim flat boring werewolf movie refuse develop energy level,0
seagal look like danny aiello day mumble way movie,0
provide nail biting suspense credible character without relying technology moment technique pretentious dialogue,1
additional storyline interesting entertaining magical quality beginning story like new footage still love old stuff,1
tried anything would fail perhaps explode level manic whimsy right,1
yet another entry sentimental oh wacky brit genre ushered full monty still straining produce another smash hit,0
recent tension rekindled kathleen soliah trial upcoming trial sla member emily william harris mention sept difficult day appreciate fire bright side,0
needed little le bling bling lot romance,0
pretty funny movie humor coming incongruous chemically perfect teaming crystal de niro,1
movie something borrowed construction feel le product loving well integrated homage like mere excuse wan thinly sketched story killing time going,0
serving sara little mall movie designed kill time,0
tsai well deserved reputation one cinema world great visual stylist film every shot enhances excellent performance,1
whenever think seen end movie cut new scene also appears end get another scene another begin long end credit desert rain,0
whole movie simply lazy exercise bad filmmaking asks suspend disbelief intelligence well,0
christina ricci comedy sympathy hypocrisy love misfire,0
like world film hartley created monster know handle,0
witty touching well paced,1
one key problem ardently christian storyline never question thing turn,0
four feather lack genuine sweep feeling even character worth caring,0
everything quiet american good except timing,1
tennessee williams way oprah book club,0
low rate annie featuring kid act echo jordan weirdo actor crispin glover screwing thing old school,0
fiendishly cunning even jaded cinema audience leave auditorium feeling dizzy confused totally disorientated mention absolutely refreshed,1
spielberg rare director want invite viewer gawk applaud special effect want part action wallpaper chosen reality thankfully,1
frida artistic brilliance undeniable among breathtakingly designed film ever seen,1
turturro fabulously funny top sneaky butler excels art impossible disappearing reappearing act,1
work utmost subtlety perception mark outstanding feature debut writer director eric byler understands power implicit virtue simplicity economy,1
director peter kosminsky give woman forum demonstrate acting chop take full advantage,1
start witty sophisticated want love filmmaker yvan attal quickly writes corner,0
tasty masala,1
imagine possible pasolini film without passion politics almodovar movie without beauty humor idea glum numb experience watching fantasma,0
sandra bullock hugh grant make great team predictable romantic comedy get pink slip,0
thoughtful visually graceful work,1
real woman may many agenda also win big way,1
replacing john carpenter stylish tracking shot degraded handheld blair witch video cam footage halloween visually unappealing,0
fitfully amusing romp nothing else appeal fan malcolm middle pubescent star frankie muniz,0
vastness implied metropolis breathtaking,1
simplistic fluff ball whimsy,0
two hour fly opera pleasure endure intermission even novice form come away exhilarated,1
brian tufano handsome widescreen photography paul grabowsky excellent music turn fairly parochial melodrama something really rather special,1
